<?xml version="1.0" encoding="UTF-8"?><!-- tarefa 1 UD7 -->
<garderia xmlns:xsi="http://www.w3.org/2001/XMLSchema-instance" xsi:noNamespaceSchemaLocation="Tarefa_03_A.xsd">
  <neno numeroExpedente="2344" codigo="P73-123">
    <sexo>M</sexo>
    <nome>Noa Blanco Coello</nome>
    <dataNacemento>2010/10/12</dataNacemento>
    <peso>13.5</peso>
    <altura>78</altura>
    <vacunas>true</vacunas>
    <contacto relacion="pai">123456789</contacto>
    <idade anos="1" meses="11" />
  </neno>
</garderia>